{
  "protocol": "0.5.0",
  "id": "expedition-example-agent-mrxrjy04",
  "parentWorldHash": "world-000006318",
  "terrainHash": "4441db20eee18e58ee9d80839865cdd7f0d708b6a4ea590c4e24ed43398054da",
  "agentId": "example-agent",
  "proof": {
    "route": [
      {
        "x": 0,
        "y": 1.546140993013978e-11,
        "z": 0,
        "altitudeM": 5259.0000000000155,
        "slopeDegrees": 11.656809941744175,
        "surface": "ROCK",
        "mode": "WALK"
      },
      {
        "x": 27.31729189720549,
        "y": 8.00000000012551,
        "z": -30.92222222222222,
        "altitudeM": 5267.0000000001255,
        "slopeDegrees": 28.983370571818842,
        "surface": "ROCK",
        "mode": "WALK"
      },
      {
        "x": 54.63458379441098,
        "y": 41.99999999927786,
        "z": -61.84444444444444,
        "altitudeM": 5300.999999999278,
        "slopeDegrees": 34.7187424823865,
        "surface": "ROCK",
        "mode": "SCRAMBLE"
      },
      {
        "x": 81.95187569161646,
        "y": 65.99999999978354,
        "z": -92.76666666666667,
        "altitudeM": 5324.9999999997835,
        "slopeDegrees": 31.703347846101682,
        "surface": "ROCK",
        "mode": "WALK"
      },
      {
        "x": 109.26916758882196,
        "y": 99.00000000002456,
        "z": -123.68888888888888,
        "altitudeM": 5358.000000000025,
        "slopeDegrees": 40.22475262039886,
        "surface": "ROCK",
        "mode": "SCRAMBLE"
      },
      {
        "x": 136.58645948602745,
        "y": 131.99999999955162,
        "z": -154.61111111111111,
        "altitudeM": 5390.999999999552,
        "slopeDegrees": 36.44672378252625,
        "surface": "ROCK",
        "mode": "SCRAMBLE"
      },
      {
        "x": 163.90375138323293,
        "y": 152.99999999983447,
        "z": -185.53333333333333,
        "altitudeM": 5411.9999999998345,
        "slopeDegrees": 22.975993515826115,
        "surface": "ROCK",
        "mode": "WALK"
      },
      {
        "x": 191.22104328043844,
        "y": 167.99999999996453,
        "z": -216.45555555555555,
        "altitudeM": 5426.9999999999645,
        "slopeDegrees": 26.162527822913386,
        "surface": "ROCK",
        "mode": "WALK"
      },
      {
        "x": 218.53833517764392,
        "y": 190.99999999962074,
        "z": -247.37777777777777,
        "altitudeM": 5449.999999999621,
        "slopeDegrees": 34.68350895107431,
        "surface": "ROCK",
        "mode": "SCRAMBLE"
      },
      {
        "x": 245.8556270748494,
        "y": 225.9999999997308,
        "z": -278.3,
        "altitudeM": 5484.999999999731,
        "slopeDegrees": 39.74766950153995,
        "surface": "ROCK",
        "mode": "SCRAMBLE"
      },
      {
        "x": 273.1729189720549,
        "y": 250.99999999987995,
        "z": -309.22222222222223,
        "altitudeM": 5509.99999999988,
        "slopeDegrees": 29.4280504129514,
        "surface": "ROCK",
        "mode": "WALK"
      },
      {
        "x": 300.4902108692604,
        "y": 279.00000000017553,
        "z": -340.14444444444445,
        "altitudeM": 5538.0000000001755,
        "slopeDegrees": 50.479718357540584,
        "surface": "ROCK",
        "mode": "CLIMB",
        "protected": true
      },
      {
        "x": 327.80750276646586,
        "y": 337.99999999964894,
        "z": -371.06666666666666,
        "altitudeM": 5596.999999999649,
        "slopeDegrees": 55.321798289386955,
        "surface": "ROCK",
        "mode": "CLIMB",
        "protected": true
      },
      {
        "x": 355.12479466367137,
        "y": 386.00000000015916,
        "z": -401.9888888888889,
        "altitudeM": 5645.000000000159,
        "slopeDegrees": 50.27391279883911,
        "surface": "ROCK",
        "mode": "CLIMB",
        "protected": true
      },
      {
        "x": 382.4420865608769,
        "y": 421.9999999998372,
        "z": -432.9111111111111,
        "altitudeM": 5680.999999999837,
        "slopeDegrees": 45.114874335181895,
        "surface": "ROCK",
        "mode": "SCRAMBLE"
      },
      {
        "x": 409.7593784580823,
        "y": 448.0000000000464,
        "z": -463.8333333333333,
        "altitudeM": 5707.000000000046,
        "slopeDegrees": 44.137835094766864,
        "surface": "SNOW",
        "mode": "SCRAMBLE"
      },
      {
        "x": 437.07667035528783,
        "y": 478.00000000010186,
        "z": -494.75555555555553,
        "altitudeM": 5737.000000000102,
        "slopeDegrees": 46.772152302482844,
        "surface": "SNOW",
        "mode": "SCRAMBLE"
      },
      {
        "x": 464.39396225249334,
        "y": 522.0000000003456,
        "z": -525.6777777777778,
        "altitudeM": 5781.000000000346,
        "slopeDegrees": 52.349827437638254,
        "surface": "SNOW",
        "mode": "CLIMB",
        "protected": true
      },
      {
        "x": 491.7112541496988,
        "y": 581.9999999992524,
        "z": -556.6,
        "altitudeM": 5840.999999999252,
        "slopeDegrees": 62.12942001031197,
        "surface": "SNOW",
        "mode": "CLIMB",
        "protected": true
      },
      {
        "x": 519.0285460469044,
        "y": 678.9999999994752,
        "z": -587.5222222222222,
        "altitudeM": 5937.999999999475,
        "slopeDegrees": 67.74626860813709,
        "surface": "SNOW",
        "mode": "CLIMB",
        "protected": true
      },
      {
        "x": 546.3458379441098,
        "y": 768.0000000003374,
        "z": -618.4444444444445,
        "altitudeM": 6027.000000000337,
        "slopeDegrees": 66.26771321713669,
        "surface": "SNOW",
        "mode": "CLIMB",
        "protected": true
      },
      {
        "x": 573.6631298413153,
        "y": 857.9999999989013,
        "z": -649.3666666666667,
        "altitudeM": 6116.999999998901,
        "slopeDegrees": 63.24818982507489,
        "surface": "SNOW",
        "mode": "CLIMB",
        "protected": true
      },
      {
        "x": 600.9804217385208,
        "y": 928.9999999995998,
        "z": -680.2888888888889,
        "altitudeM": 6187.9999999996,
        "slopeDegrees": 61.465508394580915,
        "surface": "SNOW",
        "mode": "CLIMB",
        "protected": true
      },
      {
        "x": 628.2977136357263,
        "y": 1011.0000000000546,
        "z": -711.2111111111111,
        "altitudeM": 6270.000000000055,
        "slopeDegrees": 62.52197895282707,
        "surface": "SNOW",
        "mode": "CLIMB",
        "protected": true
      },
      {
        "x": 655.6150055329317,
        "y": 1081.9999999995407,
        "z": -742.1333333333333,
        "altitudeM": 6340.999999999541,
        "slopeDegrees": 57.90431167366157,
        "surface": "SNOW",
        "mode": "CLIMB",
        "protected": true
      },
      {
        "x": 682.9322974301373,
        "y": 1144.9999999993452,
        "z": -773.0555555555555,
        "altitudeM": 6403.999999999345,
        "slopeDegrees": 52.809207109460694,
        "surface": "SNOW",
        "mode": "CLIMB",
        "protected": true
      },
      {
        "x": 710.2495893273427,
        "y": 1190.999999999899,
        "z": -803.9777777777778,
        "altitudeM": 6449.999999999899,
        "slopeDegrees": 48.574706506063244,
        "surface": "SNOW",
        "mode": "CLIMB",
        "protected": true
      },
      {
        "x": 737.5668812245482,
        "y": 1243.9999999992024,
        "z": -834.9,
        "altitudeM": 6502.999999999202,
        "slopeDegrees": 46.802720486549745,
        "surface": "SNOW",
        "mode": "SCRAMBLE"
      },
      {
        "x": 764.8841731217537,
        "y": 1267.000000000031,
        "z": -865.8222222222222,
        "altitudeM": 6526.000000000031,
        "slopeDegrees": 33.90835721323815,
        "surface": "ICE",
        "mode": "SCRAMBLE"
      },
      {
        "x": 792.2014650189592,
        "y": 1276.9999999999472,
        "z": -896.7444444444444,
        "altitudeM": 6535.999999999947,
        "slopeDegrees": 36.76019464338652,
        "surface": "SNOW",
        "mode": "SCRAMBLE"
      },
      {
        "x": 819.5187569161646,
        "y": 1287.999999999979,
        "z": -927.6666666666666,
        "altitudeM": 6546.999999999979,
        "slopeDegrees": 39.407657960034804,
        "surface": "SNOW",
        "mode": "SCRAMBLE"
      },
      {
        "x": 846.8360488133702,
        "y": 1318.0000000000928,
        "z": -958.5888888888888,
        "altitudeM": 6577.000000000093,
        "slopeDegrees": 44.15310963096644,
        "surface": "SNOW",
        "mode": "SCRAMBLE"
      },
      {
        "x": 874.1533407105757,
        "y": 1346.000000000242,
        "z": -989.5111111111111,
        "altitudeM": 6605.000000000242,
        "slopeDegrees": 48.14556442678734,
        "surface": "SNOW",
        "mode": "CLIMB",
        "protected": true
      },
      {
        "x": 901.4706326077811,
        "y": 1382.9999999998427,
        "z": -1020.4333333333333,
        "altitudeM": 6641.999999999843,
        "slopeDegrees": 46.966448544754776,
        "surface": "SNOW",
        "mode": "SCRAMBLE"
      },
      {
        "x": 928.7879245049867,
        "y": 1405.0000000001783,
        "z": -1051.3555555555556,
        "altitudeM": 6664.000000000178,
        "slopeDegrees": 41.73731154857457,
        "surface": "SNOW",
        "mode": "SCRAMBLE"
      },
      {
        "x": 956.1052164021921,
        "y": 1429.0000000001728,
        "z": -1082.2777777777778,
        "altitudeM": 6688.000000000173,
        "slopeDegrees": 46.83263955369379,
        "surface": "SNOW",
        "mode": "SCRAMBLE"
      },
      {
        "x": 983.4225082993976,
        "y": 1452.0000000000719,
        "z": -1113.2,
        "altitudeM": 6711.000000000072,
        "slopeDegrees": 46.004395282542966,
        "surface": "SNOW",
        "mode": "SCRAMBLE"
      },
      {
        "x": 1010.7398001966031,
        "y": 1453.000000000634,
        "z": -1144.1222222222223,
        "altitudeM": 6712.000000000634,